{
  "entries": [
    {
      "id": "turn-1",
      "role": "gm",
      "sender": "Game Master",
      "content": "The adventure begins."
    }
  ],
  "status": {
    "hp": { "current": 20, "max": 20 },
    "mp": { "current": 10, "max": 10 },
    "condition": ["healthy"],
    "inventory": ["sword"],
    "skills": ["slash"]
  },
  "options": ["Look around", "Rest"],
  "theme": "fantasy",
  "background": "scenes/tavern.png",
  "sprite": { "name": "hero", "position": "center", "expression": "neutral" },
  "hiddenDice": [{ "notation": "1d20", "purpose": "encounter" }],
  "diceRequest": { "notation": "1d20", "purpose": "strength check" },
  "profileUpdates": [{ "characterId": "hero_01", "dynamicProfile": "Met the innkeeper." }],
  "summary": "A short synopsis."
}